{
  "$schema": "https://json-schema.org/draft/2020-12/schema",
  "title": "Schema.org Recipe subset v1",
  "type": "object",
  "additionalProperties": false,
  "required": [
    "@context",
    "@type",
    "name",
    "description",
    "recipeYield",
    "prepTime",
    "cookTime",
    "totalTime",
    "recipeIngredient",
    "recipeInstructions"
  ],
  "properties": {
    "@context": {
      "type": "string"
    },
    "@type": {
      "type": "string",
      "const": "Recipe"
    },
    "name": {
      "type": "string",
      "minLength": 1
    },
    "description": {
      "type": [
        "string",
        "null"
      ]
    },
    "recipeYield": {
      "type": [
        "string",
        "null"
      ]
    },
    "prepTime": {
      "type": [
        "string",
        "null"
      ]
    },
    "cookTime": {
      "type": [
        "string",
        "null"
      ]
    },
    "totalTime": {
      "type": [
        "string",
        "null"
      ]
    },
    "recipeIngredient": {
      "type": "array",
      "items": {
        "type": "string",
        "minLength": 1
      },
      "minItems": 1
    },
    "recipeInstructions": {
      "type": "array",
      "items": {
        "type": "object",
        "additionalProperties": false,
        "required": [
          "@type",
          "text"
        ],
        "properties": {
          "@type": {
            "type": "string",
            "const": "HowToStep"
          },
          "text": {
            "type": "string",
            "minLength": 1
          }
        }
      },
      "minItems": 1
    }
  }
}
